{
  "schema_version": "1.0.0",
  "id": "bug-investigation",
  "title": "Bug investigation",
  "applies_when": [
    "reproducing a defect",
    "narrow causal fix"
  ],
  "does_not_apply_when": [
    "greenfield features",
    "release qualification alone"
  ],
  "minimum_roles": [
    "clean-debug",
    "clean-build",
    "clean-test",
    "clean-verify"
  ],
  "minimum_evidence": [
    "repro-notes",
    "failing-test-or-NOT_AVAILABLE",
    "verification-report"
  ],
  "arena_warranted": "no for routine fixes; yes only if multiple plausible architectural causes remain after diagnosis",
  "adversarial_probes_warranted": "yes when residual risk is medium/high after the fix",
  "parallel_guidance": "discovery and regression test authoring may run in parallel when scopes do not share mutable files",
  "terminal_states": [
    "PASS",
    "FAIL",
    "NOT_RUN",
    "NOT_AVAILABLE",
    "BLOCKED"
  ]
}
