{
  "schema_version": "1.0.0",
  "id": "code-review",
  "title": "Code review",
  "applies_when": [
    "independent review of a finished revision with evidence"
  ],
  "does_not_apply_when": [
    "author self-approval",
    "review without a revision and evidence bundle"
  ],
  "minimum_roles": [
    "clean-review",
    "clean-reviewer"
  ],
  "minimum_evidence": [
    "diff",
    "requirements",
    "verification-report",
    "review-packet",
    "requirement-call-path-test-matrix"
  ],
  "arena_warranted": "no",
  "adversarial_probes_warranted": "review may request probes; it does not replace them",
  "parallel_guidance": "use separate reviewer contexts only when the host provides real isolation; otherwise run standards and spec passes sequentially in one context and record procedural separation plus the limitation; reconcile blocking dispositions before ship",
  "terminal_states": [
    "PASS",
    "FAIL",
    "NOT_RUN",
    "NOT_AVAILABLE",
    "BLOCKED"
  ]
}
